"qrB46R3D","leo. Cras vehicula aliquet","ovularas4a","2009-06-13 07:26:49","comedy"
"cez74y1E","dolor elit, pellentesque a,","silsinsoria2j","2008-10-27 02:33:14","comedy"
"GvX52B9s","pretium neque. Morbi quis urna.","Candice1","2008-07-25 17:51:46","comedy"
"yeR64L4B","Phasellus elit pede, malesuada vel, venenatis vel,","Janna.David","2008-11-26 12:17:14","film"
"PcR39G8Q","ipsum leo elementum","Marks","2009-02-14 07:51:52","gaming"
"Ofr36Q7B","interdum. Nunc","Reed4","2009-10-07 11:51:32","gaming"
"Fnm23y1w","at pretium","Cadman.Giles","2009-04-01 04:33:20","entertainment"
"kZD44x2C","commodo tincidunt nibh. Phasellus nulla. Integer vulputate,","Teagan.Wiley","2008-07-17 21:58:08","sports"
"Ojv81c1m","malesuada fames ac","Brennan","2008-04-07 18:23:15","comedy"
"RDG04V3S","placerat, augue. Sed molestie. Sed id risus","litakuwaue","2009-02-14 18:46:01","film"
"rAj35m2w","rutrum eu, ultrices sit amet, risus. Donec","Flowers","2009-11-04 08:26:06","entertainment"
"uOt52j3F","consequat, lectus","sazmanng3","2009-12-26 15:51:05","sports"
"jsO54w2T","interdum. Sed auctor","Marks","2009-07-25 16:14:27","entertainment"
"JwC56V0X","pharetra ut, pharetra","dolcian0x","2009-12-12 09:27:48","film"
"JLe93z9w","vulputate, risus","Stella4","2008-02-21 12:07:08","film"
"bno84V6k","odio. Etiam ligula tortor, dictum","Callie4","2009-06-29 20:50:24","music"
"HYZ83P7e","quis turpis vitae purus","Katell.Webb","2009-05-14 07:02:52","comedy"
"bVs06T3o","est mauris, rhoncus","Dillon.Richards","2008-10-07 20:58:59","music"
"rFc42z1B","orci, adipiscing non, luctus sit amet, faucibus","quenquaf9","2009-03-27 01:58:42","music"
"QUD79f3y","et, magna.","sazmanng3","2008-03-14 00:39:09","sports"
"Qwe65v6D","ipsum primis in faucibus orci luctus et","Chanda.Brown","2009-10-12 08:45:38","entertainment"
"Ezf13e1C","lobortis risus. In mi pede, nonummy ut,","simoletto50","2008-04-28 03:15:04","film"
"PJD17S3d","eget mollis lectus pede","Holden","2009-02-21 11:03:05","music"
"RdR39b9a","scelerisque scelerisque dui. Suspendisse ac metus vitae","August10","2008-03-24 10:04:56","sports"
"NKF35b1w","erat. Etiam vestibulum","calliparik2","2008-01-24 10:58:01","music"
"ffv40v6F","quis accumsan convallis, ante lectus convallis","Morin","2009-06-29 00:30:26","gaming"
"yJb88X6W","lobortis risus. In mi pede, nonummy","Janna.David","2008-04-07 15:20:25","entertainment"
"cqd92A2k","magnis dis","Cameran2","2009-01-06 15:46:14","entertainment"
"Tto09Z1h","Praesent eu dui.","Athena10","2008-12-27 20:23:32","music"
"UPn40i3W","lorem. Donec elementum,","Athena10","2008-10-15 11:29:14","gaming"
"Syn73d1a","in faucibus orci luctus","kalgarijux5","2009-06-04 13:55:24","entertainment"
"Kwz18t2i","enim, sit amet ornare lectus justo","oslanjateox","2009-02-14 22:14:54","comedy"
"Bbn21V4R","vitae purus gravida sagittis.","Nissim","2009-04-12 17:37:27","sports"
"jYo58N3T","libero. Proin sed turpis","Holden","2009-01-21 04:00:12","comedy"
"vWu60e8h","Aliquam ornare,","Marks","2008-11-27 09:51:07","entertainment"
"twp90b2D","tincidunt orci","vitaleno4","2009-08-30 02:49:35","entertainment"
"FWQ46j0Y","mauris, rhoncus id, mollis nec, cursus","Madison.Flores","2008-09-05 12:11:29","comedy"
"MsT95G5D","nulla magna, malesuada vel, convallis in,","Rooney3","2008-01-27 07:01:12","film"
"pEh01f6v","libero nec","Gwendolyn","2009-01-19 11:16:46","music"
"uBj57Y0e","mauris ut mi. Duis","Flavia.Potts","2008-01-31 23:28:50","entertainment"
"Ybz37m8H","erat. Vivamus nisi. Mauris nulla. Integer urna.","treseluu","2009-12-18 01:39:21","gaming"
"XrK13E5H","eu elit.","Declan5","2009-05-24 01:50:07","music"
"dPn74b7w","laoreet ipsum. Curabitur consequat,","Rooney3","2009-03-22 14:16:53","film"
"xiR85H6s","nec tempus scelerisque, lorem ipsum sodales","Ocean.Wyatt","2008-01-04 06:53:14","music"
"gOQ43y4f","libero. Integer in magna. Phasellus dolor","Sophia.Flowers","2009-10-06 15:47:06","entertainment"
"jNk13t4s","Curae; Donec tincidunt. Donec vitae erat","Janna.David","2009-03-05 05:52:59","sports"
"nRK89d7E","tellus. Phasellus elit pede, malesuada vel,","Hale","2009-07-25 17:38:15","gaming"
"oYN86I3r","nulla. Integer urna.","Rosalyn","2008-01-06 23:21:17","sports"
"OwG25c7E","Suspendisse aliquet, sem ut","Wyatt","2009-05-30 05:45:11","entertainment"
"IFw50G1a","convallis ligula. Donec luctus aliquet odio.","Stella4","2008-07-30 14:48:25","film"
"MBQ15i1v","Nunc mauris elit, dictum eu, eleifend","izsvb","2009-05-20 21:49:39","music"
"Rec36b9m","cursus et, magna. Praesent interdum ligula","svetlanagj","2008-09-03 18:31:35","music"
"Qwg78k6u","cubilia Curae; Donec tincidunt. Donec vitae erat","chefappapleaj","2008-05-01 02:03:04","music"
"eEj88Y1x","ultricies adipiscing, enim","Brennan","2009-05-27 03:39:48","gaming"
"jBM09X3R","commodo tincidunt","calliparik2","2008-01-11 19:32:02","comedy"
"pvZ03k6y","turpis nec mauris blandit mattis.","Declan5","2009-01-05 08:54:54","music"
"WPM08n2G","mauris elit, dictum eu, eleifend nec,","Mayer","2009-06-05 10:52:49","film"
"mCG28X7X","penatibus et magnis dis parturient montes,","Vivian.Morin","2008-02-23 20:49:25","sports"
"CCt76t2c","euismod enim. Etiam gravida molestie","Bernard.Peters","2009-03-04 16:15:37","entertainment"
"lYn58j2C","velit. Aliquam","Poole","2009-12-23 15:53:13","sports"
"pyc43j5x","commodo tincidunt nibh.","Flowers","2009-05-20 01:54:39","entertainment"
"MVW75W1Y","non, lacinia at, iaculis quis, pede. Praesent","snowwhite5831i","2008-10-07 17:59:26","gaming"
"sCl89r4H","iaculis aliquet diam. Sed","Marks","2009-08-31 16:31:35","music"
"xxA57q0E","facilisis non,","zaskomlijnp","2009-04-28 05:35:10","music"
"lQK88q0b","Cras convallis convallis dolor.","Reed4","2008-03-09 15:35:36","film"
"Lpc67S9D","ultrices a, auctor non,","Webb","2008-07-31 07:11:57","gaming"
"pPO51p8m","nec ante","Ocean.Wyatt","2009-05-30 02:49:10","sports"
"sIh27I8V","cursus purus. Nullam","Claire4","2009-03-03 14:16:18","entertainment"
"dPP44p2e","montes, nascetur ridiculus mus. Aenean eget","Galloway","2009-03-28 00:05:32","gaming"
"ECg38n0H","fermentum risus, at fringilla purus mauris","Ocean.Wyatt","2009-11-19 20:26:00","sports"
"JfH46k6b","Cras vehicula aliquet libero.","Brown","2008-07-18 12:12:36","gaming"
"Fkx05w5S","ipsum primis","shaihkritzercl","2008-04-11 20:17:31","entertainment"
"qEP91r1V","nunc sit","mozgovafl","2008-03-25 02:09:02","film"
"vvj77T1Q","molestie. Sed","Flavia.Potts","2008-04-08 12:45:02","film"
"lda07b3F","sed pede. Cum sociis natoque penatibus","Brian.Galloway","2008-02-14 15:24:38","music"
"JJg79v5P","commodo auctor velit. Aliquam","Gwendolyn","2009-07-15 19:16:34","entertainment"
"ebP26k3U","rutrum urna, nec luctus felis purus","silsinsoria2j","2009-08-07 08:43:14","entertainment"
"vHU39m2L","mi fringilla mi lacinia mattis. Integer eu","Bender","2008-10-05 12:50:49","sports"
"feg73I0y","mauris sagittis placerat. Cras dictum ultricies","Scott.Shields","2009-10-12 19:14:39","music"
"rdV68n8r","Nullam feugiat placerat velit. Quisque varius.","mozgovafl","2008-03-02 21:30:07","music"
"KJA91r9R","Suspendisse dui. Fusce diam nunc, ullamcorper eu,","Morin","2009-06-27 12:20:58","film"
"VVT42X2M","euismod et, commodo at, libero. Morbi","acordoru6","2009-03-03 18:35:09","entertainment"
"OlJ75j0w","magna. Duis dignissim tempor arcu. Vestibulum","Derek3","2008-05-08 11:45:36","film"
"EcE53r7i","dui nec urna suscipit nonummy. Fusce","Lucy9","2008-02-02 12:35:11","sports"
"Eyp53p8e","vitae velit egestas lacinia. Sed","Brown","2008-08-06 00:25:49","music"
"Ghj44n6V","vehicula et, rutrum eu, ultrices","Declan5","2009-08-22 07:35:23","film"
"pAB79K1Z","est tempor","Morin","2008-07-09 08:35:36","comedy"
"UAM29O8G","massa. Quisque porttitor eros","4k3o2m1zhw","2008-08-23 09:50:54","entertainment"
"XOt54r2w","et nunc. Quisque ornare","Watson","2009-02-20 01:15:31","gaming"
"EjS70L0R","convallis est, vitae","oslanjateox","2009-08-30 06:39:51","comedy"
"dlm43k0x","ullamcorper eu, euismod ac, fermentum vel, mauris.","Mann","2008-10-03 10:54:48","comedy"
"ChC46p8H","Aliquam fringilla cursus purus. Nullam scelerisque","Hedwig.Kennedy","2008-10-08 12:00:43","sports"
"FaM71D7a","massa. Vestibulum","Isabella","2008-12-10 04:09:26","music"
"fLu44W4Z","justo. Praesent luctus.","pibak","2008-06-30 04:56:50","music"
"bTA57U3x","arcu. Morbi sit amet massa. Quisque porttitor","Hale","2008-01-09 15:56:04","comedy"
"IeV93B1m","magna a neque. Nullam ut nisi a","lopticommc","2009-09-01 07:02:38","comedy"
"kFf16i7U","lorem eu metus. In lorem.","Holden","2008-06-29 00:58:27","comedy"
"xWx23n6k","ornare, libero","Quin6","2008-06-09 13:21:20","comedy"
"ooh14h6S","Etiam ligula tortor, dictum eu, placerat","calliparik2","2008-01-14 12:19:00","music"
"Wtf13y4r","penatibus et","mozgovafl","2009-06-17 13:11:11","music"
"NNn20P0J","magna et","Sophia.Flowers","2008-12-30 03:49:30","entertainment"
"gxp94h9T","Suspendisse sagittis. Nullam vitae diam. Proin","treseluu","2009-03-01 02:52:46","sports"
"CAE21K1u","ipsum sodales purus, in molestie tortor nibh","Indira6","2008-03-19 01:29:43","music"
"cNi18t8H","semper pretium neque. Morbi quis","Quin6","2009-07-15 23:59:56","music"
"yNS34B9u","Quisque imperdiet, erat nonummy","dolcian0x","2008-06-22 01:58:17","film"
"USX78z4V","at, velit. Cras lorem lorem, luctus ut,","Mayer","2009-02-12 09:05:19","comedy"
"eaT56q4v","dictum eu,","Isabella","2008-11-03 20:50:56","sports"
"eKE59k3Q","porttitor scelerisque neque.","quenquaf9","2009-07-19 12:40:10","gaming"
"fAh40T2d","ornare egestas ligula.","Janna.David","2008-08-06 10:42:22","entertainment"
"Unl99u5p","convallis erat, eget tincidunt dui","Poole","2008-12-24 12:17:13","comedy"
"JKZ65M2m","iaculis quis, pede. Praesent","svetlanagj","2009-05-01 19:09:02","entertainment"
"NTM99u2k","pharetra. Quisque ac libero nec ligula","Candice1","2008-12-23 11:33:57","film"
"tAi97S0W","Donec felis orci, adipiscing non,","Marks","2009-09-27 19:14:16","comedy"
"JYW89D8j","non, cursus","oslanjateox","2009-04-28 15:09:45","entertainment"
"edB78U3v","in sodales elit erat vitae risus. Duis","Roth.Poole","2009-03-22 03:46:10","sports"
"TOX08L5h","Donec fringilla.","Coleman","2008-03-17 09:12:04","film"
"DxN71F2N","gravida sit","Roth.Poole","2008-03-03 03:21:39","gaming"
"cSD56A8j","erat semper rutrum.","quenquaf9","2009-10-02 23:54:17","music"
"JRm57x9J","varius orci, in consequat enim","Webb","2009-09-04 15:15:01","sports"
"akM92t1x","eget laoreet posuere, enim nisl","Cadman.Giles","2008-11-13 15:04:21","film"
"QtK48T3X","dignissim pharetra. Nam ac","chinleongck","2008-12-29 21:30:09","gaming"
"Bqu83q6L","et, rutrum eu, ultrices sit amet,","Hedwig5","2008-06-29 14:20:10","comedy"
"DIq73i4V","non, egestas","Rooney3","2009-03-18 03:59:45","film"
"KBG81i0B","luctus ut, pellentesque eget, dictum","Derek3","2009-09-24 02:17:17","music"
"ehy86s1Z","dictum sapien. Aenean massa. Integer vitae","Peters","2009-03-02 04:11:21","gaming"
"ioc78q0o","mi fringilla mi lacinia mattis.","Ocean.Wyatt","2009-04-29 03:54:59","music"
"ifJ32T1G","eget tincidunt","Stella4","2008-08-29 13:08:22","gaming"
"uZR79W8F","cursus in, hendrerit consectetuer, cursus et, magna.","Cheryl","2008-05-06 19:59:20","entertainment"
"abi90k0W","cursus in, hendrerit consectetuer,","Howard","2009-12-22 00:47:23","music"
"scX36G3m","magna. Sed eu eros. Nam","Celeste3","2008-04-26 19:16:32","entertainment"
"Gfz85k4Q","eu odio tristique pharetra. Quisque ac","quenquaf9","2008-05-20 22:39:04","comedy"
"Lst01b8J","odio sagittis semper. Nam tempor","Vivian.Morin","2008-02-19 19:19:22","comedy"
"qNI58p4o","nec, eleifend non, dapibus rutrum, justo. Praesent","Howard","2009-07-26 23:09:40","entertainment"
"KQh69C7G","luctus. Curabitur egestas nunc","Flowers","2009-05-28 19:27:08","gaming"
"InC42E2c","Aenean eget magna. Suspendisse tristique neque venenatis","Flavia.Potts","2008-07-13 20:53:51","gaming"
"qKc58p6S","ante blandit viverra. Donec tempus, lorem fringilla","Ocean.Wyatt","2009-04-02 16:14:59","music"
"fCK54n2I","nonummy. Fusce fermentum fermentum arcu.","4k3o2m1zhw","2009-06-18 09:30:37","gaming"
"IRk26T5i","dictum placerat,","missy7280iy","2008-08-18 02:46:14","gaming"
"KeZ61G2h","ac urna.","izsvb","2009-12-29 20:07:15","gaming"
"uLi16A5l","Mauris blandit enim consequat purus. Maecenas","Morin","2008-10-16 10:41:43","gaming"
"Zpl92K0X","molestie. Sed id risus","Oconnor","2008-01-27 19:15:26","sports"
"eTM71X5s","nulla. Integer urna. Vivamus molestie","4k3o2m1zhw","2009-09-18 13:44:32","music"
"tqa17E0X","sapien, cursus","Marks","2009-07-30 23:35:04","comedy"
"KlC33m0a","nascetur ridiculus mus.","Galloway","2009-05-06 21:23:07","comedy"
"wjt93z1m","sem elit, pharetra ut, pharetra sed, hendrerit","Derek3","2009-10-07 18:46:22","comedy"
"MdR50X1i","sed dui. Fusce","Hedwig5","2009-03-16 04:05:44","music"
"mIM01E1C","purus. Nullam scelerisque","Scott.Shields","2009-11-24 08:15:01","sports"
"QAW57h4g","nulla vulputate dui, nec","Holden","2009-03-31 09:27:18","gaming"
"PMw66y8W","penatibus et","Rosalyn","2009-09-09 11:49:39","music"
"kUc98c2M","neque tellus,","pibak","2008-09-25 04:22:39","comedy"
"vEg21S0v","neque non quam. Pellentesque habitant morbi tristique","Callie4","2008-09-13 06:22:31","entertainment"
"uvp09z7t","Class aptent taciti sociosqu ad litora","Claire4","2009-02-21 21:11:36","gaming"
"LVI13n5l","felis ullamcorper viverra. Maecenas","Adams","2009-03-14 14:26:34","gaming"
"sgA10S0x","magna et ipsum cursus vestibulum.","Rooney3","2008-09-07 05:44:44","music"
"ZvD32d9s","ultrices posuere cubilia Curae; Phasellus","Sierra1","2009-05-14 20:43:11","gaming"
"BsY21x3L","orci lobortis augue scelerisque mollis. Phasellus libero","Ocean.Wyatt","2008-10-28 14:37:02","sports"
"dyP05T7g","augue malesuada malesuada. Integer id","Howard","2008-08-12 07:22:16","music"
"wqT73e1u","gravida mauris ut mi. Duis risus","Marks","2009-06-28 23:34:30","music"
"BNp23I4S","ac turpis egestas.","Nissim","2008-03-09 16:46:35","sports"
"nlD38W7s","Donec feugiat","Carson.Stuart","2009-09-08 23:48:15","comedy"
"EZr30j6p","egestas lacinia. Sed congue, elit","Celeste3","2009-12-22 05:41:42","entertainment"
"BMa84L7e","et netus","Chloe7","2008-11-05 07:24:32","gaming"
"fsh74j6J","sodales nisi magna sed dui. Fusce aliquam,","lirizam9o","2009-07-15 21:21:29","comedy"
"Fux24s9S","bibendum fermentum metus. Aenean sed pede","Derek3","2009-03-25 13:19:58","gaming"
"VfQ34l0L","dictum sapien. Aenean massa.","Flores","2009-04-07 04:22:36","sports"
"Lke01K1v","ac mattis ornare, lectus ante","Flavia.Potts","2008-09-02 10:49:16","comedy"
"wEB48R2b","Ut nec urna et arcu","Webb","2008-09-09 04:52:24","entertainment"
"CIx87Z6D","non, luctus sit","Isabella.Wiggins","2008-05-06 13:50:54","sports"
"cEM41e6H","lobortis risus. In mi pede, nonummy","Peters","2009-11-18 07:01:09","comedy"
"MBA13o2b","vitae, orci. Phasellus dapibus quam quis","Callie4","2009-04-18 16:03:42","gaming"
"bGe46E0z","nec urna suscipit","vitaleno4","2008-07-03 09:14:43","music"
"CaF90k8m","Pellentesque ut ipsum ac","lopticommc","2009-06-16 06:42:33","film"
"nVn69v6A","bibendum fermentum metus.","missy7280iy","2008-05-15 13:47:42","entertainment"
"Hff15q8Z","porttitor interdum. Sed","August10","2009-04-22 05:59:16","film"
"yqc92P9O","quis urna.","Athena10","2009-05-21 01:07:03","music"
"mgJ42t8e","ipsum sodales purus, in molestie","sazmanng3","2009-12-10 15:05:13","film"
"KDi15I3J","vehicula aliquet libero. Integer in magna.","Athena10","2009-07-15 15:45:30","sports"
"fHz75m5D","augue id ante dictum cursus. Nunc mauris","Carson.Stuart","2009-12-21 20:38:54","film"
"yKg25L6T","Aenean gravida nunc sed pede.","Isabella.Wiggins","2008-04-24 06:08:11","sports"
"Imy54F9T","erat vel pede blandit congue. In","Holden","2008-08-15 06:00:35","entertainment"
"ANs73P5i","dolor. Fusce mi lorem, vehicula","Cadman.Giles","2008-10-28 11:26:43","sports"
"VWB81P1q","Cras vulputate velit eu","Stella4","2008-03-18 15:25:32","music"
"JZx40y0L","eu dolor egestas rhoncus.","Derek3","2008-07-29 16:17:24","gaming"
"rjE58W1M","vehicula aliquet libero. Integer in magna.","calliparik2","2008-01-24 15:51:34","film"
"aQs81P3I","mollis. Phasellus libero mauris,","Oconnor","2009-03-01 20:23:24","gaming"
"OHY39F9x","mauris blandit","acordoru6","2009-05-02 15:27:28","sports"
"xPl96d6j","Vivamus rhoncus. Donec est. Nunc ullamcorper,","Stella4","2008-11-04 00:10:45","comedy"
"xnp27i4c","felis ullamcorper viverra. Maecenas","snowwhite5831i","2009-12-04 20:15:26","sports"
"Qca84l6Y","nec, imperdiet","missy7280iy","2008-10-23 11:02:44","comedy"
"vVO11v8b","orci, adipiscing non, luctus sit","solobuscamev3","2008-12-16 14:01:54","comedy"
"PGu22u5y","tincidunt. Donec vitae erat vel pede blandit","August10","2008-12-22 10:02:59","gaming"
"TBc93h2z","Suspendisse dui. Fusce","Chanda.Brown","2008-09-20 21:01:26","music"
"YhN84b1G","est. Mauris eu turpis. Nulla","Janna.David","2009-11-15 15:58:00","comedy"
"Zgx47b5e","Vestibulum ut eros non enim commodo hendrerit.","Athena10","2009-09-01 17:02:39","music"
"qcD97P7h","vulputate, posuere vulputate, lacus. Cras interdum.","Flores","2008-06-23 14:01:50","gaming"
"zYq32l5I","tempor arcu.","dolcian0x","2008-03-15 12:46:30","sports"
"ECF30G0h","ultrices. Vivamus rhoncus. Donec est.","shaihkritzercl","2009-04-09 12:29:22","sports"
"jNR08w6B","Donec porttitor tellus non magna. Nam","fanion51","2009-05-28 19:05:55","music"
"xNP65p2c","lacus vestibulum lorem, sit amet ultricies sem","zaskomlijnp","2008-05-17 01:18:52","comedy"
"PiF90C1w","at auctor ullamcorper, nisl arcu","Quin6","2009-08-20 18:12:07","entertainment"
"kEJ22t5i","Nam consequat dolor vitae","Adams","2008-02-06 14:30:33","music"
"vaX07e1b","eget, venenatis a, magna. Lorem ipsum dolor","izsvb","2008-06-10 08:41:06","gaming"
"MRu32p8k","vulputate, lacus. Cras interdum. Nunc sollicitudin","Galloway","2009-03-25 09:13:58","gaming"
"WnP77Y2L","erat eget ipsum.","fanion51","2008-06-11 22:13:58","comedy"
"VDK95e9p","sagittis placerat. Cras dictum ultricies","August10","2008-03-15 20:16:24","gaming"
"jpq15o0Y","Donec est mauris, rhoncus id,","Flowers","2009-01-11 19:53:53","film"
"hin09B1O","nunc risus","kalgarijux5","2008-10-30 07:39:22","entertainment"
"Fkh22w0V","vel sapien imperdiet ornare. In faucibus.","acordoru6","2009-07-29 00:44:06","gaming"
"eoR29A9A","semper cursus. Integer mollis. Integer tincidunt","Scott.Shields","2008-12-11 01:22:29","entertainment"
"jHi82A4Z","ligula. Nullam feugiat placerat velit. Quisque","Madison.Flores","2009-06-26 06:26:12","music"
"AOb22p6N","arcu. Nunc mauris. Morbi non sapien molestie","Katell.Webb","2008-05-21 22:54:58","gaming"
"MjK97f9O","nunc. In at pede. Cras vulputate velit","Webb","2009-05-31 21:07:57","entertainment"
"jgK45A9H","arcu. Morbi sit","Brennan","2009-09-12 00:41:04","entertainment"
"fiA92G8d","vitae odio sagittis","Isabella.Wiggins","2009-07-19 14:16:16","sports"
"yME57S9c","purus, in molestie tortor nibh","snowwhite5831i","2009-09-01 15:14:23","music"
"hHs00W9B","Vestibulum ut eros non","Oconnor","2008-07-21 17:09:07","film"
"Ykv16G1e","mauris sapien, cursus in, hendrerit","Hale","2008-05-17 10:57:27","gaming"
"mPc40W2K","Nunc quis","chefappapleaj","2008-12-11 22:07:39","music"
"PiC65x5o","sed pede. Cum","solobuscamev3","2008-04-02 03:27:42","gaming"
"YTl99M1A","nisi dictum augue malesuada malesuada.","Watson","2008-06-22 19:30:47","music"
"pqe99P0X","commodo hendrerit. Donec porttitor tellus","solobuscamev3","2009-11-22 08:20:48","entertainment"
"SKl93E2y","Curae; Donec tincidunt. Donec vitae","Flores","2009-05-03 11:07:24","sports"
"oaq23S7i","eget mollis lectus","Hedwig5","2009-04-30 17:04:25","comedy"
"CLD92o2R","tincidunt vehicula risus. Nulla eget metus","Peters","2009-02-04 07:46:14","sports"
"SUf57E0S","Etiam imperdiet dictum","Claire4","2008-10-21 10:32:36","comedy"
"XgQ39B5o","rutrum lorem","Coleman","2008-01-29 18:15:43","comedy"
"Ejf48Z5K","risus. Donec egestas. Aliquam nec","Claire4","2009-02-22 17:52:50","film"
"cCw45r0E","mauris ipsum porta elit, a","simoletto50","2008-05-29 15:18:29","entertainment"
"fpL59o2g","quis arcu vel quam dignissim","missy7280iy","2008-09-04 13:50:37","comedy"
"qYC36w8O","Mauris vestibulum, neque","Celeste3","2008-03-01 08:41:10","sports"
"Mus02Q8Z","turpis non enim. Mauris quis turpis vitae","Brennan","2008-10-17 18:24:51","entertainment"
"HcT64F3g","magna a tortor. Nunc","Cadman.Giles","2009-05-19 02:16:17","gaming"
"CxZ66b7b","vehicula aliquet","Hedwig5","2008-06-18 20:17:32","music"
"YoE03T7S","mauris erat eget ipsum. Suspendisse sagittis.","Sierra1","2008-09-17 20:47:25","comedy"
"ziA93x1h","diam. Sed diam lorem, auctor quis,","Galloway","2008-05-15 13:48:02","entertainment"
"RUn95m2i","bibendum fermentum metus. Aenean sed pede","Wyatt","2008-04-01 20:31:10","music"
"HhZ67h3K","vulputate ullamcorper","lirizam9o","2008-03-24 13:38:36","film"
"VlO41m8H","vestibulum. Mauris magna. Duis dignissim","Cadman.Giles","2009-09-16 01:51:41","sports"
"Rgf84y2D","ut, sem. Nulla interdum.","svetlanagj","2009-01-14 07:15:37","gaming"
"WvZ81j9y","eleifend non, dapibus","4k3o2m1zhw","2008-08-15 13:35:12","music"
"AMi12E3g","ipsum primis in faucibus orci luctus","Flores","2009-11-30 21:39:30","music"
"zPA34w0P","eleifend nec, malesuada ut, sem. Nulla interdum.","Rooney3","2008-05-08 19:35:35","entertainment"
"UBN26O3x","ut erat. Sed","Ocean.Wyatt","2009-10-09 20:45:05","entertainment"
"nSe76c7f","scelerisque, lorem ipsum sodales purus, in molestie","simoletto50","2009-01-23 15:52:32","comedy"
"Iox56V5u","volutpat. Nulla dignissim. Maecenas ornare","izsvb","2009-10-02 14:05:23","gaming"
"opZ85j3b","ipsum. Suspendisse","Scott.Shields","2008-04-03 16:41:54","gaming"
"Wda17r7W","Nam ac","Dillon.Richards","2008-07-23 14:18:11","film"
"yWE53c4D","Nullam enim. Sed nulla","Claire4","2008-03-29 12:29:32","music"
"Cbs12m1I","ac libero nec","Mann","2009-01-12 09:04:13","music"
"SkY40n2K","sem, vitae aliquam eros turpis non","silsinsoria2j","2008-02-24 17:44:44","sports"
"ZlX24N5j","at pretium aliquet,","Marks","2008-02-03 17:50:16","entertainment"
"ZGw03R8M","ultrices posuere","Nissim","2008-01-13 05:46:08","gaming"
"KTG99v1K","Nullam scelerisque neque sed sem","Chanda.Brown","2009-06-30 06:07:46","film"
"FMB54M6I","nisi magna sed dui. Fusce aliquam, enim","ovularas4a","2008-07-09 01:51:29","sports"
"lbG91b9I","Aliquam erat volutpat. Nulla facilisis.","Dillon.Richards","2008-07-12 01:11:38","entertainment"
"xCa83j0w","at lacus. Quisque purus sapien, gravida","Rosalyn","2009-06-11 18:56:01","gaming"
"Ega02p1p","elit, pretium et, rutrum non,","Celeste3","2008-10-12 04:25:30","entertainment"
"XWr43c4K","id ante dictum cursus.","Cadman.Giles","2009-11-07 03:22:12","music"
"MfM79E6X","vel sapien imperdiet ornare. In","Hedley8","2008-04-06 08:17:32","music"
"pRY48O2n","augue, eu tempor erat","lopticommc","2009-05-27 18:54:06","music"
"ioh40j7v","aliquet, metus","treseluu","2008-12-15 16:24:52","entertainment"
"suC85w5O","enim. Suspendisse aliquet, sem ut","Celeste3","2009-04-22 07:32:59","gaming"
"Dmx46I0S","Suspendisse non leo. Vivamus","sazmanng3","2008-12-18 23:55:59","film"
"qBf61g6l","purus gravida sagittis. Duis gravida.","Vivian.Morin","2008-08-13 22:36:39","film"
"kso30P9k","magnis dis parturient montes,","Vivian.Morin","2008-12-26 03:24:03","film"
"WnZ76v2z","mollis lectus","Aline7","2008-04-24 21:18:20","film"
"oaZ94t6U","ut, pellentesque eget, dictum placerat,","Chloe7","2008-08-28 15:43:28","comedy"
"dtH24q7F","ante lectus convallis est, vitae","Peters","2008-06-17 18:20:44","gaming"
"tId60E2r","Donec dignissim magna a tortor.","Candice1","2009-10-26 23:34:58","film"
"KaO83V0C","vulputate eu, odio. Phasellus","Mcintyre","2009-06-03 19:19:38","gaming"
"XSf30w1U","Integer urna.","Mayer","2008-07-14 13:42:27","film"
"qPr00V2j","nonummy ultricies ornare, elit elit","Callie4","2009-07-07 18:41:10","music"
"CKH31F8g","id sapien. Cras","Cheryl","2008-10-17 12:07:25","comedy"
"SCj81h0G","sed, sapien. Nunc","Vivian.Morin","2008-07-19 15:31:14","music"
"GpX30z1J","leo. Morbi neque","Adams","2008-06-22 18:44:35","film"
"cLQ43L4h","ornare lectus","Scott.Shields","2009-09-17 00:38:08","entertainment"
"xtb15r3D","sed pede nec ante blandit","Gwendolyn","2009-05-19 06:44:58","sports"
"XTz55e5Y","Nunc pulvinar arcu et pede. Nunc sed","Cameran2","2009-02-12 22:05:37","gaming"
"ouk43e1K","Sed auctor odio a purus.","Bender","2008-02-10 16:53:15","gaming"
"vsW99F2f","velit. Cras lorem lorem, luctus ut,","Webb","2008-03-19 13:14:55","gaming"
"Ivb87U1f","leo elementum sem, vitae aliquam","Mcintyre","2009-05-02 22:16:13","film"
"dkc46Q9H","Nulla dignissim.","Galloway","2009-03-19 14:45:51","music"
"VcG48V8x","ridiculus mus. Proin vel arcu eu odio","lirizam9o","2008-03-30 10:53:51","music"
"Puk64c3A","nunc sit amet metus. Aliquam erat","crashtest17tf","2009-01-30 04:48:12","entertainment"
"Mzk58t0U","pede ac urna.","Janna.David","2008-05-18 15:25:09","entertainment"
"BMi54k6x","erat. Vivamus nisi.","Carson.Stuart","2009-10-29 15:25:54","music"
"Lcj41R9C","in consequat enim diam vel arcu.","Aline7","2008-10-17 17:33:06","film"
"Tbm81W9h","interdum ligula","Quin6","2009-03-20 03:31:25","film"
"CeG68m9B","aliquet. Proin velit. Sed malesuada augue","Brennan","2008-02-26 02:00:50","film"
"UMg75c5V","lacinia vitae, sodales at, velit. Pellentesque ultricies","chefappapleaj","2008-10-27 06:29:51","gaming"
"mnR98I5J","Nulla tincidunt, neque vitae","Isabella.Wiggins","2008-06-14 03:44:37","comedy"
"Eop67c9z","aliquet odio. Etiam ligula","Indira6","2009-10-07 21:44:05","sports"
"GaK04k3S","eleifend non, dapibus rutrum, justo. Praesent","Indira6","2009-10-01 03:13:58","music"
"OIl08j4p","mattis. Cras eget","Rooney3","2009-01-12 01:40:12","film"
"nGJ15f0G","nec enim. Nunc ut erat. Sed nunc","missy7280iy","2009-08-20 04:47:35","entertainment"
"zqJ57I6l","amet ante.","Wyatt","2008-11-20 06:39:09","entertainment"
